Film,Year,URL Encoded name,Image File Name,Agency Credit,Artist Credit,Director/Filmmaker Name,Director/Filmmaker IMDB Link,Location Display Text,LATITUDE,LONGITUDE,Borough,Neighborhood,Scene Type,Media,IMDB LINK,Client or book location indicator,Notes,Book Image,Book Page,Display?,IMAGE OF LOCATION,ratings,Awards,Box Office,Director,Genre,Language,Plot,Poster,Rated,Runtime,imdbID,imdbVotes
*batteries not included,1987,%2Abatteries%20not%20included,batteriesnotincluded_pf,Courtesy of Photofest,Directed by,Matthew Robbins,http://imdb.com/name/nm0730422/,E. 5th St.<br>East Village<br>Manhattan,40.7224453,-73.97865057,Manhattan,East Village,0,Film,http://imdb.com/title/tt0092494/,0,0,Y,190,0,Y,6.7,2 wins & 1 nomination.,N/A,Matthew Robbins,"Comedy, Family, Fantasy, Sci-Fi",0.0,Aliens help a feisty old New York couple in their battle against the ruthless land developer who's out to evict them.,https://m.media-amazon.com/images/M/MV5BM2JlMDgxOTYtNmI2My00YzY1LWIyZTgtYzY0MjY3Y2RiZmY2L2ltYWdlL2ltYWdlXkEyXkFqcGdeQXVyNTI4MjkwNjA@._V1_SX300.jpg,PG,106 min,tt0092494,"31,122"
12 Angry Men,1957,12%20Angry%20Men,12AngryMen_pf,Courtesy of Photofest,Directed by,Sidney Lumet,http://imdb.com/name/nm0001486/,New York County Courthouse<br>40 Foley Square<br>Lower Manhattan,40.7137,-74.0079,Manhattan,Lower Manhattan,0,Film,http://imdb.com/title/tt0050083/,"New York County
Courthouse on Foley Square.",0,Y,40,0,Y,9.0,Nominated for 3 Oscars. Another 17 wins & 10 nominations.,N/A,Sidney Lumet,"Crime, Drama",0.0,A jury holdout attempts to prevent a miscarriage of justice by forcing his colleagues to reconsider the evidence.,https://m.media-amazon.com/images/M/MV5BMWU4N2FjNzYtNTVkNC00NzQ0LTg0MjAtYTJlMjFhNGUxZDFmXkEyXkFqcGdeQXVyNjc1NTYyMjg@._V1_SX300.jpg,Approved,96 min,tt0050083,"682,907"
13 Going on 30,2004,13%20Going%20on%2030,13Goingon30_ec,"Courtesy of Everett Collection, Inc.",Directed by,Gary Winick,http://imdb.com/name/nm0935095/,W. 47th St. and Seventh Ave.<br>Times Square<br>Manhattan,40.75922049,-73.98462117,Manhattan,Times Square,0,Film,http://www.imdb.com/title/tt0337563/,"47th St. and 7th Ave. Times Square
Manhattan",0,Y,239,0,Y,6.2,11 nominations.,N/A,Gary Winick,"Comedy, Fantasy, Romance",0.0,"A girl makes a wish on her thirteenth birthday, and wakes up the next day as a thirty-year-old woman.",https://m.media-amazon.com/images/M/MV5BMjE1NzI5NTkwMF5BMl5BanBnXkFtZTYwOTA4NzY2._V1_SX300.jpg,PG-13,98 min,tt0337563,"165,280"
15 Minutes,2001,15%20Minutes,0,0,Directed by,John Herzfeld,http://imdb.com/name/nm0381273/,E. 60-66th St. and Madison Ave.<br>Upper East Side<br>Manhattan,40.7661,-73.9696,Manhattan,Upper East Side,Chases,Film,http://www.imdb.com/title/tt0179626/,60-66th and Madison,0,Y,82,0,N,6.1,1 nomination.,"$24,403,552",John Herzfeld,"Action, Crime, Drama, Thriller",0.0,A homicide detective and a fire marshal must stop a pair of murderers who commit videotaped crimes to become media darlings.,https://m.media-amazon.com/images/M/MV5BMTI3MzQ1MzIwNl5BMl5BanBnXkFtZTYwMTAxODc5._V1_SX300.jpg,R,120 min,tt0179626,"48,253"
25th Hour,2002,25th%20Hour,25thHour1_pf,Courtesy of Photofest,Directed by,Spike Lee,http://www.imdb.com/name/nm0000490/,World Trade Center<br>Lower Manhattan,40.71179263,-74.01232839,Manhattan,Lower Manhattan,0,Film,http://www.imdb.com/title/tt0307901/,World Trade Center,0,Y,93,0,Y,7.6,Nominated for 1 Golden Globe. Another 4 wins & 16 nominations.,"$13,084,595",Spike Lee,Drama,0.0,"Cornered by the DEA, convicted New York drug dealer Montgomery Brogan reevaluates his life in the 24 remaining hours before facing a seven-year jail term.",https://m.media-amazon.com/images/M/MV5BNmE0YjdlYTktMTU4Ni00Mjk2LWI3NWMtM2RjNmFiOTk4YjYxL2ltYWdlXkEyXkFqcGdeQXVyNTAyODkwOQ@@._V1_SX300.jpg,R,135 min,tt0307901,"169,256"
25th Hour,2002,25th%20Hour,25thHour2_pf,Courtesy of Photofest,Directed by,Spike Lee,http://www.imdb.com/name/nm0000490/,Carl Schurz Park<br>Upper East Side<br>Manhattan,40.77506559,-73.94312739,Manhattan,Upper East Side,0,Film,http://www.imdb.com/title/tt0307901/,Carl Schurz Park btwn 84th and 85th and promenade,0,Y,209,0,Y,7.6,Nominated for 1 Golden Globe. Another 4 wins & 16 nominations.,"$13,084,595",Spike Lee,Drama,0.0,"Cornered by the DEA, convicted New York drug dealer Montgomery Brogan reevaluates his life in the 24 remaining hours before facing a seven-year jail term.",https://m.media-amazon.com/images/M/MV5BNmE0YjdlYTktMTU4Ni00Mjk2LWI3NWMtM2RjNmFiOTk4YjYxL2ltYWdlXkEyXkFqcGdeQXVyNTAyODkwOQ@@._V1_SX300.jpg,R,135 min,tt0307901,"169,256"
A Perfect Murder,1998,A%20Perfect%20Murder,0,0,Directed by,Andrew Davis,http://imdb.com/name/nm0001112/,Long Island City,40.74607025,-73.95038009,Queens,Queens,0,Film,http://www.imdb.com/title/tt0120787/,Long Island City,0,Y,141,N,N,6.5,2 wins & 3 nominations.,"$67,638,368",Andrew Davis,"Crime, Drama, Thriller",0.0,"A wealthy Wall Street speculator discovers that his wife has a lover. He investigates him and uses the carrot and stick to make him murder his wife. Planned to detail, it seems like a perfect murder.",https://m.media-amazon.com/images/M/MV5BMTcwODQxNTEyN15BMl5BanBnXkFtZTYwNTE3NzI3._V1_SX300.jpg,R,107 min,tt0120787,"79,011"
A Thousand Clowns,1965,A%20Thousand%20Clowns,AThousandClowns_pf,Courtesy of Photofest,Directed by,Fred Coe,http://imdb.com/name/nm0168641/,Statue of Liberty<br>Liberty Island<br>New York Harbor,40.68958731,-74.04379606,Manhattan,New York Harbor,0,Film,http://www.imdb.com/title/tt0059798/,"Statue of Liberty, Liberty Island, New York Harbor",poor quality,Y,51,0,Y,7.4,Won 1 Oscar. Another 3 wins & 7 nominations.,N/A,Fred Coe,"Comedy, Drama, Romance",0.0,"A middle-aged iconoclast, doggedly avoiding the tedium of employment and conventional life, faces the prospect of losing custody of his young ward.",https://m.media-amazon.com/images/M/MV5BZDQyOTA4ZTItYzJhMy00ZjA0LWEwYWEtYTdhNGE1ZDgxOWNiXkEyXkFqcGdeQXVyNzc5MjA3OA@@._V1_SX300.jpg,Unrated,118 min,tt0059798,"3,154"
Across the Sea of Time,1997,Across%20the%20Sea%20of%20Time,AcrossTheSeaOfTime_pf,Courtesy of Photofest,Directed by,Stephen Low,http://imdb.com/name/nm0522844/,New York Harbor,40.69899091,-74.03849602,Manhattan,New York Harbor,0,Film,http://imdb.com/title/tt0112286/,0,0,Y,0,0,Y,6.0,N/A,N/A,Stephen Low,"Adventure, Drama, Family, History",0.0,"A young Russian boy, Thomas Minton, travels to New York as a passenger on a Russian freighter. Close to Ellis Island he gets off and thus starts his journey to America the same way as all ...",https://m.media-amazon.com/images/M/MV5BOTIwMzk1MDc1MF5BMl5BanBnXkFtZTcwMTEzNDkyMQ@@._V1_SX300.jpg,G,51 min,tt0112286,234
After Hours,1985,After%20Hours,0,0,Directed by,Martin Scorsese,http://imdb.com/name/nm0000217/,Mercer and Grand<br>SoHo<br>Manhattan,40.7213,-74.0015,Manhattan,SoHo,0,Film,http://www.imdb.com/title/tt0088680/,SoHo,0,Y,154,N,N,7.7,Nominated for 1 Golden Globe. Another 3 wins & 9 nominations.,N/A,Martin Scorsese,"Comedy, Crime, Drama, Thriller",0.0,An ordinary word processor has the worst night of his life after he agrees to visit a girl in Soho who he met that evening at a coffee shop.,https://m.media-amazon.com/images/M/MV5BMTUxMjEzMzI2MV5BMl5BanBnXkFtZTgwNTU3ODAxMDE@._V1_SX300.jpg,R,97 min,tt0088680,"57,533"
Alice,1990,Alice,0,0,Directed by,Woody Allen,http://www.imdb.com/name/nm0000095/,E. 95th St. off Madison Ave.<br>Upper East Side<br>Manhattan,40.7866,-73.9547,Manhattan,Upper East Side,0,Film,http://www.imdb.com/title/tt0099012/,95th Street off Madison Avenue,0,Y,224,0,N,6.6,Nominated for 1 Oscar. Another 1 win & 6 nominations.,N/A,Woody Allen,"Comedy, Romance",0.0,A spoiled Manhattan housewife re-evaluates her life after visiting a Chinatown healer.,https://m.media-amazon.com/images/M/MV5BNDQ4YzdmY2MtYzkwOS00Njk5LWI5MWUtNGQ0NzVhODIxYzkwXkEyXkFqcGdeQXVyNzc5MjA3OA@@._V1_SX300.jpg,PG-13,106 min,tt0099012,"13,200"
American Psycho,2000,American%20Psycho,AmericanPyscho_ec,"Courtesy of Everett Collection, Inc.",Directed by,Mary Harron,http://www.imdb.com/name/nm0366004/,Chinatown<br>Manhattan,40.71621654,-73.99808049,Manhattan,Chinatown,0,Film,http://www.imdb.com/title/tt0144084/,Chinatown,0,Y,140,0,Y,7.6,8 wins & 13 nominations.,"$15,070,285",Mary Harron,"Comedy, Crime, Drama",0.0,"A wealthy New York City investment banking executive, Patrick Bateman, hides his alternate psychopathic ego from his co-workers and friends as he delves deeper into his violent, hedonistic fantasies.",https://m.media-amazon.com/images/M/MV5BZTM2ZGJmNjQtN2UyOS00NjcxLWFjMDktMDE2NzMyNTZlZTBiXkEyXkFqcGdeQXVyNzkwMjQ5NzM@._V1_SX300.jpg,R,101 min,tt0144084,"483,967"
An Unmarried Woman,1978,An%20Unmarried%20Woman,0,0,Directed by,Paul Mazursky,http://imdb.com/name/nm0005196/,Mercer St. between Spring and Broome<br>SoHo<br>Manhattan,40.72255913,-74.00029063,Manhattan,SoHo,0,Film,http://www.imdb.com/title/tt0078444/,SoHo,0,Y,152-153,N,N,7.1,Nominated for 3 Oscars. Another 6 wins & 15 nominations.,N/A,Paul Mazursky,"Comedy, Drama, Romance",0.0,A wealthy woman from Manhattan's Upper East Side struggles to deal with her new identity and her sexuality after her husband of sixteen years leaves her for a younger woman.,https://m.media-amazon.com/images/M/MV5BMTNhNzU5OGItZDk5Zi00NjJlLTkzMGMtZDNmNjQ5ZjZjZjRhXkEyXkFqcGdeQXVyMjUzOTY1NTc@._V1_SX300.jpg,R,124 min,tt0078444,"4,658"
Annie Hall,1977,Annie%20Hall,AnnieHall2_pf,Courtesy of Photofest,Directed by,Woody Allen,http://www.imdb.com/name/nm0000095/,Coney Island<br>Brooklyn,40.57360922,-73.97596836,Brooklyn,Brooklyn,0,Film,http://www.imdb.com/title/tt0075686/,Coney Island boardwalk,0,Y,136,0,N,8.0,Won 4 Oscars. Another 26 wins & 8 nominations.,"$38,251,425",Woody Allen,"Comedy, Romance",0.0,Neurotic New York comedian Alvy Singer falls in love with the ditzy Annie Hall.,https://m.media-amazon.com/images/M/MV5BZDg1OGQ4YzgtM2Y2NS00NjA3LWFjYTctMDRlMDI3NWE1OTUyXkEyXkFqcGdeQXVyMjUzOTY1NTc@._V1_SX300.jpg,PG,93 min,tt0075686,"250,571"
Annie Hall,1977,Annie%20Hall,AnnieHall2_pf,Courtesy of Photofest,Directed by,Woody Allen,http://www.imdb.com/name/nm0000095/,Pier 11<br>Manhattan,40.70420461,-74.0060252,Manhattan,Lower Manhattan,0,Film,http://www.imdb.com/title/tt0075686/,Pier 11,0,Y,121,0,N,8.0,Won 4 Oscars. Another 26 wins & 8 nominations.,"$38,251,425",Woody Allen,"Comedy, Romance",0.0,Neurotic New York comedian Alvy Singer falls in love with the ditzy Annie Hall.,https://m.media-amazon.com/images/M/MV5BZDg1OGQ4YzgtM2Y2NS00NjA3LWFjYTctMDRlMDI3NWE1OTUyXkEyXkFqcGdeQXVyMjUzOTY1NTc@._V1_SX300.jpg,PG,93 min,tt0075686,"250,571"
Annie Hall,1977,Annie%20Hall,AnnieHall2_pf,Courtesy of Photofest,Directed by,Woody Allen,http://www.imdb.com/name/nm0000095/,Foot of 59th St. Bridge<br>Upper East Side<br>Manhattan,40.75780643,-73.95962834,Manhattan,Midtown,0,Film,http://www.imdb.com/title/tt0075686/,foot of 58th street bridge,0,N,0,0,N,8.0,Won 4 Oscars. Another 26 wins & 8 nominations.,"$38,251,425",Woody Allen,"Comedy, Romance",0.0,Neurotic New York comedian Alvy Singer falls in love with the ditzy Annie Hall.,https://m.media-amazon.com/images/M/MV5BZDg1OGQ4YzgtM2Y2NS00NjA3LWFjYTctMDRlMDI3NWE1OTUyXkEyXkFqcGdeQXVyMjUzOTY1NTc@._V1_SX300.jpg,PG,93 min,tt0075686,"250,571"
Annie Hall,1977,Annie%20Hall,AnnieHall2_pf,Courtesy of Photofest,Directed by,Woody Allen,http://www.imdb.com/name/nm0000095/,E. 68th St. between Park Ave. and Madison Ave.<br>Upper East Side<br>Manhattan,40.76890676,-73.96660209,Manhattan,Upper East Side,0,Film,http://www.imdb.com/title/tt0075686/,68th Street bet Park and Madison Aves,0,Y,114,0,N,8.0,Won 4 Oscars. Another 26 wins & 8 nominations.,"$38,251,425",Woody Allen,"Comedy, Romance",0.0,Neurotic New York comedian Alvy Singer falls in love with the ditzy Annie Hall.,https://m.media-amazon.com/images/M/MV5BZDg1OGQ4YzgtM2Y2NS00NjA3LWFjYTctMDRlMDI3NWE1OTUyXkEyXkFqcGdeQXVyMjUzOTY1NTc@._V1_SX300.jpg,PG,93 min,tt0075686,"250,571"
Annie Hall,1977,Annie%20Hall,AnnieHall2_pf,Courtesy of Photofest,Directed by,Woody Allen,http://www.imdb.com/name/nm0000095/,W. 95th St.<br>Upper West Side<br>Manhattan,40.79163797,-73.96653771,Manhattan,Upper West Side,0,Film,http://www.imdb.com/title/tt0075686/,West 95th Street,0,Y,222,0,Y,8.0,Won 4 Oscars. Another 26 wins & 8 nominations.,"$38,251,425",Woody Allen,"Comedy, Romance",0.0,Neurotic New York comedian Alvy Singer falls in love with the ditzy Annie Hall.,https://m.media-amazon.com/images/M/MV5BZDg1OGQ4YzgtM2Y2NS00NjA3LWFjYTctMDRlMDI3NWE1OTUyXkEyXkFqcGdeQXVyMjUzOTY1NTc@._V1_SX300.jpg,PG,93 min,tt0075686,"250,571"
As Good As It Gets,1997,As%20Good%20As%20It%20Gets,AsGoodAsitgets_pf,Courtesy of Photofest,Directed by,James L. Brooks,http://imdb.com/name/nm0000985/,Sixth Ave. between 11th St. and 12th St.<br>West Village<br>Manhattan,40.7354051,-73.99831653,Manhattan,West Village,0,Film,http://imdb.com/title/tt0119822/,Sixth Avenue btwn 11th ansd 12th St east side of 6th Ave,0,Y,206,0,Y,7.7,Won 2 Oscars. Another 36 wins & 54 nominations.,N/A,James L. Brooks,"Comedy, Drama, Romance",0.0,"A single mother and waitress, a misanthropic author, and a gay artist form an unlikely friendship after the artist is assaulted in a robbery.",https://m.media-amazon.com/images/M/MV5BNWMxZTgzMWEtMTU0Zi00NDc5LWFkZjctMzUxNDIyNzZiMmNjXkEyXkFqcGdeQXVyMTQxNzMzNDI@._V1_SX300.jpg,PG-13,139 min,tt0119822,"273,193"
Barefoot in the Park,1967,Barefoot%20in%20the%20Park,BarefootinthePark2_pf,Courtesy of Photofest,Directed by,Gene Saks,http://imdb.com/name/nm0757256/,Washington Square Park<br>West Village<br>Manhattan,40.7307223,-73.99651408,Manhattan,West Village,0,Film,http://www.imdb.com/title/tt0061385/,Washington Square Park,poor quality,Y,74-75,0,Y,7.0,Nominated for 1 Oscar. Another 6 nominations.,N/A,Gene Saks,"Comedy, Romance",0.0,"Paul, a conservative young lawyer, marries the vivacious Corie. Their highly passionate relationship descends into comical discord in a five-flight New York City walk-up apartment.",https://m.media-amazon.com/images/M/MV5BNjJiNzhkNGYtNDRhNi00NjNjLWJmZGEtOTQ1ZDM2NDM0ODgzXkEyXkFqcGdeQXVyNjUwNzk3NDc@._V1_SX300.jpg,G,106 min,tt0061385,"16,195"
Barefoot in the Park,1967,Barefoot%20in%20the%20Park,BarefootinthePark1_pf,Courtesy of Photofest,Directed by,Gene Saks,http://imdb.com/name/nm0757256/,Greenwich St. and Christopher St.<br>Greenwich Village<br>Manhattan,40.73311252,-74.00741458,Manhattan,SoHo,0,Film,http://www.imdb.com/title/tt0061385/,Greenwhich Street near Christopher Street,0,Y,74-75,0,Y,7.0,Nominated for 1 Oscar. Another 6 nominations.,N/A,Gene Saks,"Comedy, Romance",0.0,"Paul, a conservative young lawyer, marries the vivacious Corie. Their highly passionate relationship descends into comical discord in a five-flight New York City walk-up apartment.",https://m.media-amazon.com/images/M/MV5BNjJiNzhkNGYtNDRhNi00NjNjLWJmZGEtOTQ1ZDM2NDM0ODgzXkEyXkFqcGdeQXVyNjUwNzk3NDc@._V1_SX300.jpg,G,106 min,tt0061385,"16,195"
Basquiat,1996,Basquiat,Basquiat_pf,Courtesy of Photofest,Directed by,Julian Schnabel,http://imdb.com/name/nm0773603/,Lower East Side<br>Manhattan,40.71818443,-73.98885369,Manhattan,Lower East Side,0,Film,http://www.imdb.com/title/tt0115632/,[Ludlow below Delancy ] Lower East Side,0,Y,187,0,Y,6.9,2 wins & 3 nominations.,N/A,Julian Schnabel,"Biography, Drama",0.0,"The brief life of Jean Michel Basquiat, a world renowned New York street artist struggling with fame, drugs and his identity.",https://m.media-amazon.com/images/M/MV5BMTk3NTk3MzU5N15BMl5BanBnXkFtZTgwNjIwMDcyMTI@._V1_SX300.jpg,R,107 min,tt0115632,"19,266"
Bed of Roses,1996,Bed%20of%20Roses,0,0,Directed by,Michael Goldenberg,http://imdb.com/name/nm0325533/,Chelsea,40.74324155,-74.00196433,Manhattan,Chelsea,Rooftops,Film,http://www.imdb.com/title/tt0115644/,chelsea (midtown),0,Y,231,N,N,6.1,N/A,"$19,030,691",Michael Goldenberg,"Drama, Romance",0.0,"Romantic drama about a young career girl who is swept off her feet by a shy florist, who fell in love with her after one glimpse through a shadowy window.",https://m.media-amazon.com/images/M/MV5BNTUwOWM4YmUtMzdkMi00YjEwLWE0MmEtZTBmMGNhYWU4OGI3XkEyXkFqcGdeQXVyNzc5MjA3OA@@._V1_SX300.jpg,PG,87 min,tt0115644,"7,829"
BIG,1988,BIG,Big_pf,Courtesy of Photofest,Directed by,Penny Marshall,http://imdb.com/name/nm0001508/,F.A.O. Schwarz at 767 Fifth Ave.<br>Midtown<br>Manhattan,40.764053,-73.972978,Manhattan,Midtown,0,Film,http://www.imdb.com/title/tt0094737/,F.A.O. Schwarz - 58th and Fifth Avenue,poor quality,Y,162-163,0,Y,7.3,Nominated for 2 Oscars. Another 11 wins & 12 nominations.,"$115,227,281",Penny Marshall,"Comedy, Drama, Fantasy, Romance",0.0,"After wishing to be made big, a teenage boy wakes the next morning to find himself mysteriously in the body of an adult.",https://m.media-amazon.com/images/M/MV5BMDQ1ODM5MTMtMjAwYi00ZGUxLTliNTMtN2ZhODAwMjVhMTRlXkEyXkFqcGdeQXVyNTAyODkwOQ@@._V1_SX300.jpg,PG,104 min,tt0094737,"196,722"
Blue in the Face,1995,Blue%20in%20the%20Face,0,0,Directed by,"Paul Auster,Wayne Wang","http://imdb.com/name/nm0000808/,http://imdb.com/name/nm0911061/",Prospect Park West and 16th St.<br>Windsor Terrace<br>Brooklyn,40.65749448,-73.97406936,Brooklyn,Brooklyn,0,Film,http://www.imdb.com/title/tt0112541/,Prospect Park West and 16th Street in Windsor Terrace,0,Y,177,0,N,6.7,2 nominations.,N/A,"Paul Auster, Wayne Wang, Harvey Wang",Comedy,0.0,"Brooklyn Cigar Store is a neighborhood hangout in Brooklyn with Auggie Wren/H.Keitel as center. Some people are interviewed about Brooklyn, spiced up with statistics on Brooklyn.",https://m.media-amazon.com/images/M/MV5BMzMzMTBjMzQtNGVmZS00MTg2LTgyNGYtZDRjNDIzMDJiNzY4XkEyXkFqcGdeQXVyNTM3MDMyMDQ@._V1_SX300.jpg,R,83 min,tt0112541,"8,928"
Breakfast at Tiffany's,1961,Breakfast%20at%20Tiffany%27s,BreakfastatTiffanys3_ec,"Courtesy of Everett Collection, Inc.",Directed by,Blake Edwards,http://imdb.com/name/nm0001175/,Tiffany & Co. at 727 Fifth Ave.<br>Midtown<br>Manhattan,40.76251,-73.974142,Manhattan,Midtown,0,Film,http://www.imdb.com/title/tt0054698/,Tiffany & Co. - 727 Fifth Avenue at 57th Street,0,Y,49,0,Y,7.6,Won 2 Oscars. Another 8 wins & 13 nominations.,N/A,Blake Edwards,"Comedy, Drama, Romance",0.0,"A young New York socialite becomes interested in a young man who has moved into her apartment building, but her past threatens to get in the way.",https://m.media-amazon.com/images/M/MV5BNGEwMTRmZTQtMDY4Ni00MTliLTk5ZmMtOWMxYWMyMTllMDg0L2ltYWdlL2ltYWdlXkEyXkFqcGdeQXVyNjc1NTYyMjg@._V1_SX300.jpg,Approved,115 min,tt0054698,"165,451"
Breakfast at Tiffany's,1961,Breakfast%20at%20Tiffany%27s,BreakfastatTiffanys2_ec,"Courtesy of Everett Collection, Inc.",Directed by,Blake Edwards,http://imdb.com/name/nm0001175/,E. 71st St.<br>Upper East Side<br>Manhattan,40.77136061,-73.96643043,Manhattan,Upper East Side,0,Film,http://www.imdb.com/title/tt0054698/,Tiffany & Co. - 727 Fifth Avenue at 57th Street,0,Y,48,0,Y,7.6,Won 2 Oscars. Another 8 wins & 13 nominations.,N/A,Blake Edwards,"Comedy, Drama, Romance",0.0,"A young New York socialite becomes interested in a young man who has moved into her apartment building, but her past threatens to get in the way.",https://m.media-amazon.com/images/M/MV5BNGEwMTRmZTQtMDY4Ni00MTliLTk5ZmMtOWMxYWMyMTllMDg0L2ltYWdlL2ltYWdlXkEyXkFqcGdeQXVyNjc1NTYyMjg@._V1_SX300.jpg,Approved,115 min,tt0054698,"165,451"
Breakfast at Tiffany's,1961,Breakfast%20at%20Tiffany%27s,BreakfastatTiffanys1_ec,"Courtesy of Everett Collection, Inc.",Directed by,Blake Edwards,http://imdb.com/name/nm0001175/,Central Park Mall<br>Manhattan,40.77321313,-73.97127986,Manhattan,Central Park,0,Film,http://www.imdb.com/title/tt0054698/,Tiffany & Co. - 727 Fifth Avenue at 57th Street,0,Y,48,0,Y,7.6,Won 2 Oscars. Another 8 wins & 13 nominations.,N/A,Blake Edwards,"Comedy, Drama, Romance",0.0,"A young New York socialite becomes interested in a young man who has moved into her apartment building, but her past threatens to get in the way.",https://m.media-amazon.com/images/M/MV5BNGEwMTRmZTQtMDY4Ni00MTliLTk5ZmMtOWMxYWMyMTllMDg0L2ltYWdlL2ltYWdlXkEyXkFqcGdeQXVyNjc1NTYyMjg@._V1_SX300.jpg,Approved,115 min,tt0054698,"165,451"
Broadway Danny Rose,1984,Broadway%20Danny%20Rose,BroadwayDannyRose_pf,Courtesy of Photofest,Directed by,Woody Allen,http://www.imdb.com/name/nm0000095/,Carnegie Deli at 854 Seventh Ave.<br>Midtown<br>Manhattan,40.764073,-73.981288,Manhattan,Midtown,0,Film,http://www.imdb.com/title/tt0087003/,Carnegie Deli - 7th Avenue at 55th Street,poor quality,Y,158,0,Y,7.4,Nominated for 2 Oscars. Another 3 wins & 2 nominations.,"$10,600,497",Woody Allen,Comedy,0.0,"In his attempts to reconcile a lounge singer with his mistress, a hapless talent agent is mistaken as her lover by a jealous gangster.",https://m.media-amazon.com/images/M/MV5BMTkwMDQ4MjMwNF5BMl5BanBnXkFtZTcwNTM4OTYwNA@@._V1_SX300.jpg,PG,84 min,tt0087003,"23,788"
Cagney & Lacey,1982-1988,Cagney%20%26%20Lacey,CagneyandLacey_pf,Courtesy of Photofest,Created by,"Barbara Avedon,Barbara Corday,(more)","http://imdb.com/name/nm0042853/,http://imdb.com/name/nm0179400/,http://imdb.com/title/tt0083395/fullcredits#writers",Howard Beach<br>Queens,40.66553541,-73.84125709999998,Queens,Queens,0,TV,http://imdb.com/title/tt0083395/,Howard Beach ,0,Y,256,0,Y,6.8,Won 1 Golden Globe. Another 35 wins & 57 nominations.,0,N/A,"Crime, Drama, Mystery, Thriller",0.0,Two female police detectives cooperate with each other both in their professions and in their personal lives.,https://m.media-amazon.com/images/M/MV5BMTgwNjgxMDg1NF5BMl5BanBnXkFtZTcwMTE4MTQ4NA@@._V1_SX300.jpg,TV-PG,60 min,tt0083395,"3,326"
Center Stage,2000,Center%20Stage,0,0,Directed by,Nicholas Hytner,http://imdb.com/name/nm0405336/,American Ballet Theater<br>890 Broadway<br>Manhattan,40.738641,-73.989774,Manhattan,Midtown,0,Film,http://www.imdb.com/title/tt0210616/,American Ballet Theater: 890 Broadway,0,Y,215,0,N,6.7,1 win.,N/A,Nicholas Hytner,"Drama, Music, Romance",0.0,A group of 12 teenagers from various backgrounds enroll at the American Ballet Academy in New York to make it as ballet dancers and each one deals with the problems and stress of training and getting ahead in the world of dance.,https://m.media-amazon.com/images/M/MV5BODk2MjYwNDQ4MV5BMl5BanBnXkFtZTYwNzc1NDY2._V1_SX300.jpg,PG-13,115 min,tt0210616,"18,888"
Chasing Amy,1997,Chasing%20Amy,0,0,Directed by,Kevin Smith,http://imdb.com/name/nm0003620/,269 E. Houston St.<br>Lower East Side<br>Manhattan,40.721516,-73.984616,Manhattan,Lower East Side,0,Film,http://www.imdb.com/title/tt0118842/,269 East Houston Street,0,Y,188,0,N,7.2,Nominated for 1 Golden Globe. Another 5 wins & 15 nominations.,"$12,021,272",Kevin Smith,"Comedy, Drama, Romance",0.0,"Holden and Banky are comic book artists. Everything's going good for them until they meet Alyssa, also a comic book artist. Holden falls for her, but his hopes are crushed when he finds out she's a lesbian.",https://m.media-amazon.com/images/M/MV5BZDM3MTg2MGUtZDM0MC00NzMwLWE5NjItOWFjNjA2M2I4YzgxXkEyXkFqcGdeQXVyMTQxNzMzNDI@._V1_SX300.jpg,R,113 min,tt0118842,"131,882"
Clockers,1995,Clockers,Clockers2_pf,Courtesy of Photofest,Directed by,Spike Lee,http://www.imdb.com/name/nm0000490/,Gowanus Houses<br>Brooklyn,40.6841528,-73.98804903,Brooklyn,Brooklyn,0,Film,http://www.imdb.com/title/tt0112688/,"Gowanus Houses: Wycoff, Douglass, Bond and Hoyt streets",We have another photo,Y,178,0,Y,6.9,6 nominations.,"$13,071,518",Spike Lee,"Crime, Drama, Mystery",0.0,"Young drug pushers in the projects of Brooklyn live hard dangerous lives, trapped between their drug bosses and the detectives out to stop them.",https://m.media-amazon.com/images/M/MV5BY2JmNTUyYWQtMTZhMy00YTE4LTllNGItMDZmNTBiZTkyNjE2XkEyXkFqcGdeQXVyMTMxMTY0OTQ@._V1_SX300.jpg,R,128 min,tt0112688,"20,693"
Coogan's Bluff,1968,Coogan%27s%20Bluff,CoogansBluff_pf,Courtesy of Photofest,Directed by,Don Siegel,http://imdb.com/name/nm0796923/,Fort Tryon Park<br>Manhattan,40.85946031,-73.93408298,Manhattan,Fort George,0,Film,http://www.imdb.com/title/tt0062824/,Fort Tyron Park,0,Y,95,0,Y,6.5,N/A,N/A,Don Siegel,"Action, Comedy, Crime, Thriller, Western",0.0,Arizona Deputy Sheriff Coogan (Clint Eastwood) is sent to New York City to escort an escaped fugitive back for trial.,https://m.media-amazon.com/images/M/MV5BN2E3MDY5NWQtMmE5YS00ZjQ0LTgyYjItN2Q4MGVhNWY0MWFhXkEyXkFqcGdeQXVyNjc1NTYyMjg@._V1_SX300.jpg,R,93 min,tt0062824,"15,519"
Cotton Comes to Harlem,1970,Cotton%20Comes%20to%20Harlem,0,0,Directed by,Ossie Davis,http://imdb.com/name/nm0001115/,Harlem,40.80650084,-73.93928647,Manhattan,Harlem,0,Film,http://imdb.com/title/tt0065579/,Harlem,0,Y,100,N,N,6.5,1 win & 1 nomination.,N/A,Ossie Davis,"Action, Comedy, Crime",0.0,"Two Harlem cops investigate a robbery, believing that a reverend has staged it in order to steal the money he's collected for a local fundraiser.",https://m.media-amazon.com/images/M/MV5BZDFkNWUwYzEtNDM3ZS00NjAyLWFjZjgtYWRjZmJmNzZjNzJlL2ltYWdlL2ltYWdlXkEyXkFqcGdeQXVyNzc5MjA3OA@@._V1_SX300.jpg,R,97 min,tt0065579,"1,721"
Crocodile Dundee,1986,Crocodile%20Dundee,CrocodileDundee3_pf,Courtesy of Photofest,Directed by,Peter Faiman,http://imdb.com/name/nm0265363/,Fifth Ave. and 53rd St.<br>Midtown<br>Manhattan,40.7604,-73.9758,Manhattan,Midtown,0,Film,http://imdb.com/title/tt0090555/,Fifth Avenue,0,Y,133,0,Y,6.6,Nominated for 1 Oscar. Another 3 wins & 7 nominations.,N/A,Peter Faiman,"Action, Adventure, Comedy",0.0,An American reporter goes to the Australian outback to meet an eccentric crocodile poacher and invites him to New York City.,https://m.media-amazon.com/images/M/MV5BZjNlMTQ1MzQtMjNjNS00MWY4LTgxZTgtM2M5NThkMDg4N2ViXkEyXkFqcGdeQXVyMTQxNzMzNDI@._V1_SX300.jpg,PG-13,97 min,tt0090555,"91,968"
